[
  {
    "schema_version": "1.0",
    "source": "jaripon",
    "source_id": "2038",
    "source_url": "https://jaripon.ncrc.or.kr/home/kor/support/projectMng/edit.do?idx=2038&menuPos=1",
    "crawled_at": "2026-09-13T14:14:48+09:00",
    "category": "주거",
    "status": "모집종료",
    "title": "「주거 빌드업(Build-up)」 클래스 참여자 모집",
    "region": "모집종료",
    "recruitment": {
      "raw": "2026-08-13 ~ 2026-08-17",
      "start_date": "2026-08-13",
      "end_date": "2026-08-17",
      "is_evergreen": false,
      "headcount_raw": null
    },
    "application": {
      "method": "온라인",
      "url": null
    },
    "result": {
      "announcement_date_raw": "2026-08-18",
      "confirmation": "개별 연락"
    },
    "organization": {
      "name": "경기도자립지원전담기관",
      "manager_name": "자립지원1팀",
      "contact": "031-346-9314"
    },
    "view_count": 325,
    "tags": [
      "경기도자립준비청년",
      "「주거 빌드업(Build-up)」 클래스 참여자 모집"
    ],
    "eligibility": {
      "raw": null,
      "age_min": null,
      "age_max": null
    },
    "summary": "경기도자립지원전담기관에서는 자립준비청년들과 보호연장아동들이 주거와 경제에 대한 고민을 덜어낼 수 있도록 교육 프로그램을 진행하고 있습니다. LH 유스타트(자립준비청년의 LH 플랫폼)에 대해 알고 싶으신 분, LH 신청이 어려우신 분 등 신청해주세요~! ■ 모집대상: 보호종료 5년 이해 자립준비청년 및 보호연장아동 10명 *모집인원보다 지원인원이 많을 경우 아래 당사자로 선발할 수 있습니다. (부천에 거주하며 보호종료 1년 이내 자립준비청년) ■ 모집기간: 26. 8. 12. ~ 8. 17. ■ 일정: 2026. 8. 21.(금) 1",
    "content_text": "경기도자립지원전담기관에서는 자립준비청년들과 보호연장아동들이 주거와 경제에 대한 고민을 덜어낼 수 있도록 교육 프로그램을 진행하고 있습니다.\nLH 유스타트(자립준비청년의 LH 플랫폼)에 대해 알고 싶으신 분, LH 신청이 어려우신 분 등 신청해주세요~!\n■ 모집대상: 보호종료 5년 이해 자립준비청년 및 보호연장아동 10명\n*모집인원보다 지원인원이 많을 경우 아래 당사자로 선발할 수 있습니다.\n(부천에 거주하며 보호종료 1년 이내 자립준비청년)\n■ 모집기간: 26. 8. 12. ~ 8. 17.\n■ 일정: 2026. 8. 21.(금) 18:00~20:00\n■ 장소: 부천 신중동역 인근(경기도 부천시 원미구 길주로 314)\n*상세 장소 추후 안내 예정\n■ 주요 내용 및 혜택\n-LH 유스타트 안내 및 신청 방법, 좋은 집 구하는 방법, 소득 지출 구조 파악 등\n-저녁 및 식다과 제공\n-교육 참여 시 참여 물품 제공\n-주거, 경제 관련 도서 제공\n■ 신청방법: 포스터 내 QR코드 접속 혹은 링크 접속 후 신청\n(\nhttps://naver.me/GO6VYoxh\n)\n■ 문의: 031-346-9314(자립지원1팀)\n■ 기타 안내사항\n-신청서를 제출해주시면 8월 18일(화)에 담당자가 확인 후 전화 드릴 예정입니다.\n-17:50까지 장소 도착 부탁드립니다.\n-모집 인원보다 신청 인원이 초과할 시 부천시에 거주하며 보호종료 후 1년 이내 자립준비청년으로 우선 선정할 수 있습니다.\n자립준비청년들의 많은 참여 부탁드립니다.",
    "attachments": [],
    "images": [
      {
        "alt": null,
        "url": "https://jaripon.ncrc.or.kr/images/home/kor/user/main/search_icon.png"
      },
      {
        "alt": null,
        "url": "https://jaripon.ncrc.or.kr/images/home/kor/user/main/sitemap_btn_icon.png"
      },
      {
        "alt": "닫기",
        "url": "https://jaripon.ncrc.or.kr/images/home/kor/user/main/sitemap_close.png"
      },
      {
        "alt": "「주거 빌드업(Build-up)」 클래스 참여자 모집",
        "url": "https://jaripon.ncrc.or.kr/images/site/202608131024230131/png/loader.do"
      },
      {
        "alt": null,
        "url": "https://jaripon.ncrc.or.kr/images/editor/20260813/주거_빌드업(Build-up)_클래스_포스터/png/loader.do"
      },
      {
        "alt": "loading",
        "url": "https://jaripon.ncrc.or.kr/images/cmmn/action-loader.gif"
      }
    ],
    "detail_accessible": true
  },
  {
    "schema_version": "1.0",
    "source": "jaripon",
    "source_id": "1975",
    "source_url": "https://jaripon.ncrc.or.kr/home/kor/support/projectMng/edit.do?idx=1975&menuPos=1",
    "crawled_at": "2026-09-13T14:17:07+09:00",
    "category": "주거",
    "status": "모집종료",
    "title": "2026 LH전세 문제해결",
    "region": "모집종료",
    "recruitment": {
      "raw": "2026-07-13 ~ 2026-07-19",
      "start_date": "2026-07-13",
      "end_date": "2026-07-19",
      "is_evergreen": false,
      "headcount_raw": null
    },
    "application": {
      "method": "온라인",
      "url": null
    },
    "result": {
      "announcement_date_raw": "2026-07-20",
      "confirmation": "개별 전화(부재시 문자)"
    },
    "organization": {
      "name": "인천광역시자립지원전담기관",
      "manager_name": "김정현",
      "contact": "070-7663-1153"
    },
    "view_count": 234,
    "tags": [
      "LH",
      "전세",
      "사기",
      "이사",
      "공인중개사"
    ],
    "eligibility": {
      "raw": null,
      "age_min": null,
      "age_max": null
    },
    "summary": "# 전세 # 사기 # 이사 # 공인중개사 \"집 문제로 머리 아픈 사람? 우리가 함께 해결해줄게!\" 🛡️ * 변기 고장인데 집주인이 연락 안 될 때, * 서류가 너무 어려워 포기하고 싶을 때... 이렇게 막막하고 어려운 일이 생겼을 때, ✅ 신청하면 이런 일이 벌어져요! * 고민을 먼저 듣고, 그 분야의 'LH본부 직원'을 매칭해 드려요. * 상황에 따라 한명~여러명 LH본부 직원이 끝까지 해결을 돕습니다. * 참여만 해도 자립 생활에 보탬이 되는 5만원 상당의 선물을 드려요! 📍 꼭 기억하세요! ● 신청 기간: 2026. 7. 19",
    "content_text": "# 전세\n# 사기\n# 이사\n# 공인중개사\n\"집 문제로 머리 아픈 사람? 우리가 함께 해결해줄게!\" 🛡️\n* 변기 고장인데 집주인이 연락 안 될 때,\n* 서류가 너무 어려워 포기하고 싶을 때...\n이렇게 막막하고 어려운 일이 생겼을 때,\n✅ 신청하면 이런 일이 벌어져요!\n* 고민을 먼저 듣고, 그 분야의 'LH본부 직원'을 매칭해 드려요.\n* 상황에 따라 한명~여러명 LH본부 직원이 끝까지 해결을 돕습니다.\n* 참여만 해도 자립 생활에 보탬이 되는 5만원 상당의 선물을 드려요!\n📍 꼭 기억하세요!\n● 신청 기간: 2026. 7. 19.(일) 밤 12시까지\n● 해결 날짜: 2026. 7. 22.(수) 오후 2시~5시\n● 해결 장소: 인천사회복지회관 7층 상담실\n● 신청 방법:\nhttps://naver.me/FLEKrnlY\n● 진행 내용: 네이버폼 신청 → 사전 인터뷰(전화) → LH직원 매칭 → 7/22(수) 1:1 해결\n● 궁금문의: 김정현 사회복지사 (070-7663-1153)\n● 특별한 팁!! 참가자 전원에게 5만원 상당 선물 증정\n혼자 고민하지 마세요. 같이 풀어드릴게요.",
    "attachments": [],
    "images": [
      {
        "alt": null,
        "url": "https://jaripon.ncrc.or.kr/images/home/kor/user/main/search_icon.png"
      },
      {
        "alt": null,
        "url": "https://jaripon.ncrc.or.kr/images/home/kor/user/main/sitemap_btn_icon.png"
      },
      {
        "alt": "닫기",
        "url": "https://jaripon.ncrc.or.kr/images/home/kor/user/main/sitemap_close.png"
      },
      {
        "alt": "2026 LH전세 문제해결",
        "url": "https://jaripon.ncrc.or.kr/images/site/202607130834439312/jpg/loader.do"
      },
      {
        "alt": null,
        "url": "https://jaripon.ncrc.or.kr/images/editor/20260713/2026전세임대_문제해결_7월_가로500/jpg/loader.do"
      },
      {
        "alt": "loading",
        "url": "https://jaripon.ncrc.or.kr/images/cmmn/action-loader.gif"
      }
    ],
    "detail_accessible": true
  },
  {
    "schema_version": "1.0",
    "source": "jaripon",
    "source_id": "1944",
    "source_url": "https://jaripon.ncrc.or.kr/home/kor/support/projectMng/edit.do?idx=1944&menuPos=1",
    "crawled_at": "2026-09-13T14:18:15+09:00",
    "category": "주거",
    "status": "모집종료",
    "title": "신격호 롯데장학관 2026년 2학기 입주생 모집",
    "region": "모집종료",
    "recruitment": {
      "raw": "2026-06-29 ~ 2026-07-17",
      "start_date": "2026-06-29",
      "end_date": "2026-07-17",
      "is_evergreen": false,
      "headcount_raw": null
    },
    "application": {
      "method": "온라인",
      "url": null
    },
    "result": {
      "announcement_date_raw": "2026-07-30",
      "confirmation": "문자 통보"
    },
    "organization": {
      "name": "롯데장학재단 신격호 롯데장학관",
      "manager_name": "허윤서",
      "contact": "02-726-4581"
    },
    "view_count": 881,
    "tags": [],
    "eligibility": {
      "raw": null,
      "age_min": null,
      "age_max": null
    },
    "summary": "신격호 롯데장학관은 서울시 마포구에 위치하고 전액 무료로 운영되는 대학생 연합기숙사로 롯데장학재단에서 운영관리하고 있습니다. 아래와 같은 내용으로 2026년 2학기 입주 장학관생을 모집합니다. ▶자격요건(*모든 조건 충족하는 자) ① 2026년 2학기 기준 2학년, 3학년 서울 소재 대학교(4년제) 재학생 (복학 예정자 가능) ② 총 평점평균 4.5만점 기준 3.0 이상 (제출일 기준) ③ 소득분위 6분위 이하(한국장학재단 확인 및 출력 가능) ④ 신격호장학관 거주 이력이 없는 학생 ⑤ 8월 24일(월) 신규 거주 OT 필수 참석가",
    "content_text": "신격호 롯데장학관은 서울시 마포구에 위치하고 전액 무료로 운영되는 대학생 연합기숙사로 롯데장학재단에서 운영관리하고 있습니다.\n아래와 같은 내용으로 2026년 2학기 입주 장학관생을 모집합니다.\n▶자격요건(*모든 조건 충족하는 자)\n① 2026년 2학기 기준 2학년, 3학년 서울 소재 대학교(4년제) 재학생 (복학 예정자 가능)\n② 총 평점평균 4.5만점 기준 3.0 이상 (제출일 기준)\n③ 소득분위 6분위 이하(한국장학재단 확인 및 출력 가능)\n④ 신격호장학관 거주 이력이 없는 학생\n⑤ 8월 24일(월) 신규 거주 OT 필수 참석가능 학생\n▶ 거주기간\n: 2026년 8월 24일(월) ~ 2027년 8월 말 (1년)\n▶ 지원자 제출서류\n① 성적증명서\n② 소득분위 확인서\n③ 입소지원서(자기소개서)\n④ 개인정보 제공 동의서\n⑤ 자립준비청년/가정밖 청소년 증빙서류\n*재학증명서는 9월 초 제출\n▶ 절차\n◎ 서류제출\n- 이메일 접수 : lim0510@lotte.net\n- 2026년 7월 17일(금) 까지\n◎ 재단 심사 통보\n- 2026년 7월 30일(목)\n◎ 입소 OT\n- 2026년 8월 24일(월) *필수참석\n▶ 문의\n: 070-8820-9481",
    "attachments": [],
    "images": [
      {
        "alt": null,
        "url": "https://jaripon.ncrc.or.kr/images/home/kor/user/main/search_icon.png"
      },
      {
        "alt": null,
        "url": "https://jaripon.ncrc.or.kr/images/home/kor/user/main/sitemap_btn_icon.png"
      },
      {
        "alt": "닫기",
        "url": "https://jaripon.ncrc.or.kr/images/home/kor/user/main/sitemap_close.png"
      },
      {
        "alt": "신격호 롯데장학관 2026년 2학기 입주생 모집",
        "url": "https://jaripon.ncrc.or.kr/images/site/202606290147192951/png/loader.do"
      },
      {
        "alt": "loading",
        "url": "https://jaripon.ncrc.or.kr/images/cmmn/action-loader.gif"
      }
    ],
    "detail_accessible": true
  },
  {
    "schema_version": "1.0",
    "source": "jaripon",
    "source_id": "1936",
    "source_url": "https://jaripon.ncrc.or.kr/home/kor/support/projectMng/edit.do?idx=1936&menuPos=1",
    "crawled_at": "2026-09-13T14:18:37+09:00",
    "category": "주거",
    "status": "모집종료",
    "title": "26년 「자립준비청년 첫 집 길라잡이」 교육 신청 안내",
    "region": "모집종료",
    "recruitment": {
      "raw": "2026-06-29 ~ 2026-07-12",
      "start_date": "2026-06-29",
      "end_date": "2026-07-12",
      "is_evergreen": false,
      "headcount_raw": null
    },
    "application": {
      "method": "온라인",
      "url": null
    },
    "result": {
      "announcement_date_raw": "2026-07-31",
      "confirmation": "대상자 개별 안내"
    },
    "organization": {
      "name": "LH주거복지정보㈜",
      "manager_name": "이지윤",
      "contact": "031-738-3293"
    },
    "view_count": 746,
    "tags": [
      "LH주거교육",
      "유스타트",
      "전세임대",
      "매입임대",
      "건설임대",
      "생활지원"
    ],
    "eligibility": {
      "raw": null,
      "age_min": null,
      "age_max": null
    },
    "summary": "#유스타트 #전세임대 #매입임대 #건설임대 #생활지원 안녕하세요, LH주거복지정보 집밥소입니다🤗 2026년 LH유스타트 주거 및 생활지원 신청 예정인 자립준비청년·가정 밖 청소년들을 위한 <자립준비청년 첫 집 길라잡이> 교육을 준비했습니다! 대상에 해당되는 분들은 아래 내용을 참고하셔서 신청서를 작성해주세요🍀 📖교육명: 자립준비청년 첫 집 길라잡이 🚩교육내용: 2026년 LH유스타트 주거지원 제도 및 임대주택 유지보수 기초지식 📅교육일시: 아래 중 선택 가능 -1차: 8/7(금) 10:00~12:00 또는 14:00~16:00 -2",